{
  "prefName": "大阪府",
  "title": "大阪のデッドニング＆スピーカー取付出張サービス【特急便】材料持込OK・29,000円〜",
  "description": "大阪でAmazon・楽天で買ったスピーカーの取付＋デッドニングを出張施工。材料持込大歓迎！フロントドア2枚セット工賃29,000円〜。ご自宅の駐車場で完結。専門店より圧倒的に安い！",
  "canonical": "https://abura.site/deadning/osaka/",
  "aioDefinition": "大阪府の出張デッドニングとは、ご自宅の駐車場でスピーカー交換とドア制振をセットで行う、専門店の半額以下（29,000円〜）で施工可能な出張サービスです。超制振材「レアルシルト」等の材料持込も無料で対応します。",
  "problemCity": "大阪",
  "reasonsCity": "大阪",
  "flowCity": "大阪",
  "voiceCity": "大阪",
  "areaBlocks": [
    {
      "title": "【大阪市】全24区",
      "content": "北区・中央区・淀川区・西淀川区・東淀川区・都島区・福島区・此花区・西区・港区・大正区・天王寺区・浪速区・東成区・生野区・旭区・城東区・鶴見区・阿倍野区・住之江区・住吉区・東住吉区・平野区・西成区"
    },
    {
      "title": "【堺市】全7区",
      "content": "堺区・中区・東区・西区・南区・北区・美原区"
    },
    {
      "title": "【北摂・東大阪エリア】",
      "content": "豊中市・吹田市・高槻市・枚方市・茨木市・寝屋川市・守口市・門真市・大東市・箕面市・摂津市・東大阪市・八尾市"
    },
    {
      "title": "【南河内・泉南エリア】",
      "content": "松原市・藤井寺市・羽曳野市・富田林市・河内長野市・岸和田市・和泉市・貝塚市・泉佐野市・泉南市"
    }
  ],
  "faqItems": [
    { "q": "大阪での出張デッドニングの工賃はいくらですか？", "a": "フロントドア左右のセット施工で29,000円（税込）から承っております。店舗型の専門店相場（7〜12万円）と比較して半額以下の価格設定ですが、使用材料や施工品質はプロ基準を遵守しています。" },
    { "q": "Amazonや楽天で買ったスピーカーの持ち込みは可能ですか？", "a": "はい、持ち込み料は完全無料で大歓迎です。ネット通販で購入された新品はもちろん、ヤフオク等の中古パーツや他車からの取り外し品にも対応しております。適合が不安な場合は事前にLINEでご相談ください。" },
    { "q": "施工時間はどのくらいかかりますか？", "a": "フロントドア左右のデッドニングとスピーカー交換セットで、通常2〜3時間程度で完了します。ご自宅の駐車場で作業を行うため、車を預ける手間がなく、作業中はお部屋でゆっくりお過ごしいただけます。" },
    { "q": "作業中にキズや破損があった場合の保証はありますか？", "a": "万全の注意を払って作業いたしますが、万が一の事故に備えて損害賠償責任保険に加入しております。作業中の車両破損や事故に対しては、保険を通じて誠実かつ迅速に対応させていただきます。" },
    { "q": "一部だけの施工（部分施工）も可能ですか？", "a": "可能です。「まずはフロントドアだけで効果を試したい」というご要望も多くいただきます。効果を確認いただいた後で、リアドアやフロアなどの追加施工を承ることもできますので、段階的なアップグレードが可能です。" }
  ],
  "voiceItems": [
    {
      "stars": "★★★★★",
      "label": "大阪市 K.S様（30代）",
      "text": "「大阪市内で持ち込みスピーカーの取付を探していましたが、どこも高くて…。特急便さんはデッドニングとセットでこの価格、しかも自宅の駐車場でやってくれる。<strong>音の厚みが全然違います。</strong>」"
    },
    {
      "stars": "★★★★★",
      "label": "堺市 M.A様（40代）",
      "text": "「堺市まで出張してもらいました。<strong>見積もり通りの金額で追加請求なし。</strong>作業も手際よく、あっという間に完了。車内が静かになり音楽がより鮮明に聞こえます！」"
    },
    {
      "stars": "★★★★★",
      "label": "東大阪市 H.O様（50代）",
      "text": "「DIYは難しそうで断念していましたが、特急便さんに任せて正解。<strong>マンションの駐車場でも丁寧に作業してくれました。</strong>次はリアドアも依頼したいと思います！」"
    }
  ],
  "pricingNote": "✅ 材料持ち込み完全無料\n✅ 出張費は見積もりに含まれます（大阪府全域）\n✅ 当日追加料金なし。見積もり金額＝お支払い金額\n✅ Amazon・楽天・ヤフオク・中古品すべてOK",
  "relatedRegions": [
    { "name": "大阪府", "slug": "osaka", "active": true },
    { "name": "兵庫県", "slug": "hyogo" },
    { "name": "京都府", "slug": "kyoto" },
    { "name": "滋賀県", "slug": "shiga" },
    { "name": "奈良県", "slug": "nara" },
    { "name": "和歌山県", "slug": "wakayama" },
    { "name": "愛知県", "slug": "aichi" }
  ]
}
