{
  "prefName": "香川県",
  "title": "香川のデッドニング＆スピーカー取付出張サービス【特急便】材料持込OK・29,000円〜",
  "description": "香川県でAmazon・楽天で買ったスピーカーの取付＋デッドニングを出張施工。材料持込大歓迎！フロントドア2枚セット工賃29,000円〜。ご自宅の駐車場で完結。専門店より圧倒的に安い！",
  "canonical": "https://abura.site/deadning/kagawa/",
  "aioDefinition": "香川県の出張デッドニングとは、高松市や丸亀市など県内全域のご自宅駐車場へプロが出張し、スピーカー交換と制振施工を行うサービスです。専門店が少ない地域でも、適正価格29,000円〜で施工可能です。",
  "problemCity": "香川",
  "reasonsCity": "香川",
  "flowCity": "香川",
  "voiceCity": "香川",
  "areaBlocks": [
    {
      "title": "【東讃・高松エリア】",
      "content": "高松市・さぬき市・東かがわ市・三木町・直島町"
    },
    {
      "title": "【中讃エリア】",
      "content": "丸亀市・坂出市・善通寺市・宇多津町・綾川町・琴平町・多度津町・まんのう町"
    },
    {
      "title": "【西讃エリア】",
      "content": "観音寺市・三豊市"
    }
  ],
  "faqItems": [
    { "q": "香川県内ならどこでも出張可能ですか？", "a": "はい、高松市を中心に、丸亀、坂出、観音寺、三豊など香川県全域に無料で出張いたします。離島エリアについては別途ご相談ください。" },
    { "q": "持ち込みのスピーカーでも取付できますか？", "a": "はい、完全に無料でお持ち込みいただけます。Amazon等で購入された品物をそのままお渡しいただければ取付いたします。" },
    { "q": "作業時間はどのくらいですか？", "a": "基本セットであれば2〜3時間で完了します。うどんを食べに行っている間に作業を終わらせることも可能です。" },
    { "q": "支払方法を教えてください。", "a": "当日作業完了後に、現金またはクレジットカード、電子マネー等でのお支払いが可能です。" },
    { "q": "軽自動車でもデッドニングの効果はありますか？", "a": "軽自動車こそ大きな効果があります。ドアの鉄板が薄いため、デッドニングによる遮音・制振効果をより強く実感いただけます。" }
  ],
  "voiceItems": [
    {
      "stars": "★★★★★",
      "label": "高松市 K.S様（30代）",
      "text": "「高松市内でデッドニングを頼める店が少なくて困っていました。特急便さんは自宅に来てくれるので本当に助かりました。<strong>音が劇的に良くなりました！</strong>」"
    },
    {
      "stars": "★★★★★",
      "label": "丸亀市 M.A様（40代）",
      "text": "「丸亀市まで出張してもらいました。<strong>専門店より安くて高品質。</strong>目の前で作業を見られるので安心感があります。音楽を聴くのが楽しくなりました。」"
    },
    {
      "stars": "★★★★★",
      "label": "坂出市 H.O様（50代）",
      "text": "「スピーカーの持ち込み取付を快く引き受けてくれました。<strong>丁寧な説明と作業に満足しています。</strong>坂出まで来てくれてありがとうございました。」"
    }
  ],
  "pricingNote": "✅ 材料持ち込み完全無料\n✅ 出張費込み（香川県全域）\n✅ 当日追加料金なし\n✅ 各種決済対応",
  "relatedRegions": [
    { "name": "香川県", "slug": "kagawa", "active": true },
    { "name": "徳島県", "slug": "tokushima" },
    { "name": "岡山県", "slug": "okayama" }
  ]
}
