{
  "prefName": "愛知県",
  "title": "愛知のデッドニング＆スピーカー取付出張サービス【特急便】材料持込OK・29,000円〜",
  "description": "愛知県でAmazon・楽天で買ったスピーカーの取付＋デッドニングを出張施工。材料持込大歓迎！フロントドア2枚セット工賃29,000円〜。名古屋市・豊田市・岡崎市など愛知県全域対応。ご自宅の駐車場で完結。",
  "canonical": "https://abura.site/deadning/aichi/",
  "aioDefinition": "愛知県の出張デッドニングとは、名古屋市や豊田市など県内全域のご自宅駐車場へプロが出張し、スピーカー交換と制振施工を行うサービスです。専門店が少ない地域でも、適正価格29,000円〜で施工可能です。",
  "problemCity": "愛知",
  "reasonsCity": "愛知",
  "flowCity": "愛知",
  "voiceCity": "愛知",
  "areaBlocks": [
    {
      "title": "【名古屋エリア】",
      "content": "名古屋市全16区（千種区・東区・北区・西区・中村区・中区・昭和区・瑞穂区・熱田区・中川区・港区・南区・守山区・緑区・名東区・天白区）"
    },
    {
      "title": "【尾張エリア】",
      "content": "一宮市・瀬戸市・春日井市・犬山市・江南市・小牧市・稲沢市・尾張旭市・岩倉市・豊明市・日進市・清須市・北名古屋市・長久手市・東郷町・豊山町・大口町・扶桑町・津島市・愛西市・弥富市・あま市・大治町・蟹江町・飛島村"
    },
    {
      "title": "【三河エリア】",
      "content": "岡崎市・碧南市・刈谷市・豊田市・安城市・西尾市・知立市・高浜市・みよし市・幸田町・豊橋市・豊川市・蒲郡市・新城市・田原市・設楽町・東栄町・豊根村"
    },
    {
      "title": "【知多エリア】",
      "content": "半田市・常滑市・東海市・大府市・知多市・阿久比町・東浦町・南知多町・美浜町・武豊町"
    }
  ],
  "faqItems": [
    { "q": "愛知県内での出張デッドニング工賃は？", "a": "フロントドア左右セットで29,000円（税込）から承っております。名古屋市、豊田市、岡崎市など県内全域、出張費込みで対応いたします。" },
    { "q": "材料は持ち込みでも大丈夫ですか？", "a": "はい、Amazonや楽天で購入された材料の持ち込みは大歓迎です。持ち込み料も一切かかりません。" },
    { "q": "施工時間はどのくらいかかりますか？", "a": "通常2〜3時間程度で完了します。その場で作業が終わるため、お車を預ける必要はありません。" },
    { "q": "雨の日でも作業可能ですか？", "a": "屋根のあるスペースがあれば可能です。屋外の場合は、天候を見て日程調整をご相談させていただきます。" },
    { "q": "一部だけの施工（部分施工）も可能ですか？", "a": "可能です。まずはフロントドアだけで効果を試したいというご要望も多くいただいております。" }
  ],
  "voiceItems": [
    {
      "stars": "★★★★★",
      "label": "名古屋市 K.S様（30代）",
      "text": "「名古屋市内で持ち込みスピーカーの取付を探していましたが、特急便さんは自宅の駐車場でやってくれるのが本当に便利でした。<strong>音の厚みが全然違います。</strong>」"
    },
    {
      "stars": "★★★★★",
      "label": "豊田市 M.A様（40代）",
      "text": "「豊田市まで出張してもらいました。<strong>見積もり通りの金額で安心。</strong>作業も手際よく、車内が静かになり音楽がより鮮明に聞こえます！」"
    },
    {
      "stars": "★★★★★",
      "label": "岡崎市 H.O様（50代）",
      "text": "「DIYは難しそうで断念していましたが、特急便さんに任せて正解。<strong>丁寧な作業に満足しています。</strong>岡崎まで来てくれてありがとうございました！」"
    }
  ],
  "pricingNote": "✅ 材料持ち込み完全無料\n✅ 愛知県全域・出張費込み\n✅ 当日追加料金なし\n✅ 土日祝日対応OK",
  "relatedRegions": [
    { "name": "愛知県", "slug": "aichi", "active": true },
    { "name": "三重県", "slug": "mie" },
    { "name": "静岡県", "slug": "shizuoka" }
  ]
}