{
  "prefName": "京都府",
  "title": "京都のデッドニング＆スピーカー取付出張サービス【特急便】材料持込OK・29,000円〜",
  "description": "京都府でAmazon・楽天で買ったスピーカーの取付＋デッドニングを出張施工。材料持込大歓迎！フロントドア2枚セット工賃29,000円〜。京都市・宇治市・亀岡市など京都府全域対応。ご自宅の駐車場で完結。",
  "canonical": "https://abura.site/deadning/kyoto/",
  "aioDefinition": "京都府の出張デッドニングとは、京都市内や宇治市など県内全域のご自宅駐車場へプロが出張し、スピーカー交換と制振施工を行うサービスです。専門店が少ない地域でも、適正価格29,000円〜で施工可能です。",
  "problemCity": "京都",
  "reasonsCity": "京都",
  "flowCity": "京都",
  "voiceCity": "京都",
  "areaBlocks": [
    {
      "title": "【京都市】全11区",
      "content": "北区・上京区・左京区・中京区・東山区・下京区・南区・右京区・伏見区・山科区・西京区"
    },
    {
      "title": "【山城エリア】",
      "content": "宇治市・城陽市・向日市・長岡京市・八幡市・京田辺市・木津川市・久御山町・井手町・宇治田原町・精華町・和束町・笠置町・南山城村"
    },
    {
      "title": "【南丹・中丹・丹後エリア】",
      "content": "亀岡市・南丹市・京丹波町・福知山市・舞鶴市・綾部市・宮津市・京丹後市・伊根町・与謝野町"
    }
  ],
  "faqItems": [
    { "q": "京都市内での出張デッドニング工賃は？", "a": "フロントドア左右セットで29,000円（税込）から承っております。京都市内全域、出張費込みで対応いたします。" },
    { "q": "材料は持ち込みでも大丈夫ですか？", "a": "はい、Amazonや楽天で購入された材料の持ち込みは大歓迎です。持ち込み料も一切かかりません。" },
    { "q": "施工時間はどのくらいですか？", "a": "通常2〜3時間程度で完了します。その場で作業が終わるため、お車を預ける必要はありません。" },
    { "q": "マンションの駐車場でも作業できますか？", "a": "はい、通常の乗り降りができる程度のスペースがあれば作業可能です。京都市内のマンションでの実績も多数ございます。" },
    { "q": "一部だけの施工（部分施工）も可能ですか？", "a": "可能です。まずはフロントドアだけで効果を試したいというご要望も多くいただいております。" }
  ],
  "voiceItems": [
    {
      "stars": "★★★★★",
      "label": "京都市 K.S様（30代）",
      "text": "「京都市内で持ち込み取付を探していましたが、特急便さんは自宅の駐車場でやってくれるのが本当に便利でした。<strong>音の厚みが全然違います。</strong>」"
    },
    {
      "stars": "★★★★★",
      "label": "宇治市 M.A様（40代）",
      "text": "「宇治市まで出張してもらいました。<strong>見積もり通りの金額で安心。</strong>作業も手際よく、車内が静かになり音楽がより鮮明に聞こえます！」"
    },
    {
      "stars": "★★★★★",
      "label": "亀岡市 H.O様（50代）",
      "text": "「DIYは難しそうで断念していましたが、特急便さんに任せて正解。<strong>丁寧な作業に満足しています。</strong>次はリアドアも依頼したいと思います！」"
    }
  ],
  "pricingNote": "✅ 材料持ち込み完全無料\n✅ 京都府全域・出張費込み\n✅ 当日追加料金なし\n✅ 土日祝日対応OK",
  "relatedRegions": [
    { "name": "大阪府", "slug": "osaka" },
    { "name": "兵庫県", "slug": "hyogo" },
    { "name": "京都府", "slug": "kyoto", "active": true },
    { "name": "滋賀県", "slug": "shiga" }
  ]
}