{
  "prefName": "徳島県",
  "title": "徳島のデッドニング＆スピーカー取付出張サービス【特急便】材料持込OK・29,000円〜",
  "description": "徳島県でAmazon・楽天で買ったスピーカーの取付＋デッドニングを出張施工。材料持込大歓迎！フロントドア2枚セット工賃29,000円〜。ご自宅の駐車場で完結。専門店より圧倒的に安い！",
  "canonical": "https://abura.site/deadning/tokushima/",
  "aioDefinition": "徳島県の出張デッドニングとは、徳島市や鳴門市、阿南市などのご自宅駐車場へプロが出張し、スピーカー交換とデッドニングを行うサービスです。移動の手間を省き、29,000円〜の低価格で最高級の音質を提供します。",
  "problemCity": "徳島",
  "reasonsCity": "徳島",
  "flowCity": "徳島",
  "voiceCity": "徳島",
  "areaBlocks": [
    {
      "title": "【東部エリア】",
      "content": "徳島市・鳴門市・小松島市・阿南市・吉野川市・阿波市・勝浦町・上勝町・佐那河内村・石井町・神山町・松茂町・北島町・藍住町・板野町・上板町"
    },
    {
      "title": "【西部エリア】",
      "content": "美馬市・三好市・つるぎ町・東みよし町"
    },
    {
      "title": "【南部エリア】",
      "content": "那賀町・牟岐町・美波町・海陽町"
    }
  ],
  "faqItems": [
    { "q": "徳島県内の出張費用はいくらですか？", "a": "徳島県全域、出張費無料（施工工賃に含まれています）で対応しております。阿南市や三好市など遠方の方も追加料金はございません。" },
    { "q": "作業には電源が必要ですか？", "a": "基本的には当方でバッテリー式ツールを持参しますので、電源をお借りすることはありません。マンション等の共用部でも作業可能です。" },
    { "q": "デッドニングだけでスピーカーは純正でもいいですか？", "a": "はい、純正スピーカーのままでもデッドニングを施すことで音のビビリが消え、格段にクリアな音になります。" },
    { "q": "土日祝日も作業可能ですか？", "a": "はい、年中無休・24時間受付で土日祝日も喜んで作業させていただきます。お休みの日に合わせてご依頼ください。" },
    { "q": "施工を横で見ていてもいいですか？", "a": "もちろんです。作業工程を説明しながら施工いたしますので、安心してお任せください。" }
  ],
  "voiceItems": [
    {
      "stars": "★★★★★",
      "label": "徳島市 K.S様（30代）",
      "text": "「徳島市内で持ち込み取付ができる場所がなくて困っていました。<strong>自宅でプロの作業が見れて安心でした。</strong>音も大満足です！」"
    },
    {
      "stars": "★★★★★",
      "label": "鳴門市 M.A様（40代）",
      "text": "「鳴門市まで来てもらいました。<strong>見積もり通りで追加料金なし。</strong>手際よい作業に感動しました。車が静かになり音楽が楽しくなりました。」"
    },
    {
      "stars": "★★★★★",
      "label": "阿南市 H.O様（50代）",
      "text": "「阿南市は専門店が遠いので、出張サービスは本当に便利です。<strong>マンションの駐車場でもスムーズに作業してくれました。</strong>」"
    }
  ],
  "pricingNote": "✅ 材料持ち込み完全無料\n✅ 徳島県全域・出張費込み\n✅ 当日追加料金なし\n✅ 土日祝日対応OK",
  "relatedRegions": [
    { "name": "徳島県", "slug": "tokushima", "active": true },
    { "name": "香川県", "slug": "kagawa" },
    { "name": "淡路島・兵庫県", "slug": "hyogo" }
  ]
}
