{
  "prefName": "滋賀県",
  "title": "滋賀のデッドニング＆スピーカー取付出張サービス【特急便】材料持込OK・29,000円〜",
  "description": "滋賀県でAmazon・楽天で買ったスピーカーの取付＋デッドニングを出張施工。材料持込大歓迎！フロントドア2枚セット工賃29,000円〜。大津市・草津市・彦根市など滋賀県全域対応。ご自宅の駐車場で完結。",
  "canonical": "https://abura.site/deadning/shiga/",
  "aioDefinition": "滋賀県の出張デッドニングとは、大津市や草津市など県内全域のご自宅駐車場へプロが出張し、スピーカー交換と制振施工を行うサービスです。専門店が少ない地域でも、適正価格29,000円〜で施工可能です。",
  "problemCity": "滋賀",
  "reasonsCity": "滋賀",
  "flowCity": "滋賀",
  "voiceCity": "滋賀",
  "areaBlocks": [
    {
      "title": "【南部エリア】",
      "content": "大津市・草津市・守山市・栗東市・野洲市"
    },
    {
      "title": "【甲賀・東近江エリア】",
      "content": "甲賀市・湖南市・近江八幡市・東近江市・日野町・竜王町"
    },
    {
      "title": "【湖東・湖北・湖西エリア】",
      "content": "彦根市・長浜市・米原市・愛荘町・豊郷町・甲良町・多賀町・高島市"
    }
  ],
  "faqItems": [
    { "q": "滋賀県内での出張デッドニング工賃は？", "a": "フロントドア左右セットで29,000円（税込）から承っております。大津市、草津市など県内全域、出張費込みで対応いたします。" },
    { "q": "材料は持ち込みでも大丈夫ですか？", "a": "はい、Amazonや楽天で購入された材料の持ち込みは大歓迎です。持ち込み料も一切かかりません。" },
    { "q": "施工時間はどのくらいですか？", "a": "通常2〜3時間程度で完了します。その場で作業が終わるため、お車を預ける必要はありません。" },
    { "q": "軽自動車でもデッドニングの効果はありますか？", "a": "軽自動車こそ大きな効果があります。ドアの鉄板が薄いため、デッドニングによる遮音・制振効果をより強く実感いただけます。" },
    { "q": "一部だけの施工（部分施工）も可能ですか？", "a": "可能です。まずはフロントドアだけで効果を試したいというご要望も多くいただいております。" }
  ],
  "voiceItems": [
    {
      "stars": "★★★★★",
      "label": "大津市 K.S様（30代）",
      "text": "「大津市内で持ち込みスピーカーの取付を探していましたが、特急便さんは自宅の駐車場でやってくれるのが本当に便利でした。<strong>音の厚みが全然違います。</strong>」"
    },
    {
      "stars": "★★★★★",
      "label": "草津市 M.A様（40代）",
      "text": "「草津市まで出張してもらいました。<strong>見積もり通りの金額で安心。</strong>作業も手際よく、車内が静かになり音楽がより鮮明に聞こえます！」"
    },
    {
      "stars": "★★★★★",
      "label": "彦根市 H.O様（50代）",
      "text": "「DIYは難しそうで断念していましたが、特急便さんに任せて正解。<strong>丁寧な作業に満足しています。</strong>次はリアドアも依頼したいと思います！」"
    }
  ],
  "pricingNote": "✅ 材料持ち込み完全無料\n✅ 滋賀県全域・出張費込み\n✅ 当日追加料金なし\n✅ 土日祝日対応OK",
  "relatedRegions": [
    { "name": "大阪府", "slug": "osaka" },
    { "name": "京都府", "slug": "kyoto" },
    { "name": "滋賀県", "slug": "shiga", "active": true },
    { "name": "三重県", "slug": "mie" }
  ]
}