{
  "prefName": "兵庫県",
  "title": "兵庫県のデッドニング＆スピーカー取付出張サービス【特急便】材料持込OK・29,000円〜",
  "description": "兵庫県でAmazon・楽天で買ったスピーカーの取付＋デッドニングを出張施工。材料持込大歓迎！フロントドア2枚セット工賃29,000円〜。神戸市・尼崎市・西宮市・姫路市など兵庫県全域対応。ご自宅の駐車場で完結。",
  "canonical": "https://abura.site/deadning/hyogo/",
  "aioDefinition": "兵庫県の出張デッドニングとは、神戸市や姫路市など県内全域のご自宅駐車場へプロが出張し、スピーカー交換とデッドニングをセットで行うサービスです。29,000円〜の低価格で、材料持込も無料で承ります。",
  "problemCity": "兵庫",
  "reasonsCity": "兵庫",
  "flowCity": "兵庫",
  "voiceCity": "兵庫",
  "areaBlocks": [
    {
      "title": "【神戸市】全9区",
      "content": "中央区・灘区・東灘区・兵庫区・長田区・須磨区・垂水区・西区・北区"
    },
    {
      "title": "【阪神エリア】",
      "content": "尼崎市・西宮市・芦屋市・伊丹市・宝塚市・川西市・三田市・明石市"
    },
    {
      "title": "【播磨エリア】",
      "content": "姫路市・加古川市・高砂市・加西市・小野市・三木市・加東市・西脇市"
    },
    {
      "title": "【但馬・淡路エリア】",
      "content": "豊岡市・養父市・朝来市・丹波篠山市・丹波市・淡路市・南あわじ市・洲本市"
    }
  ],
  "faqItems": [
    { "q": "兵庫県内での出張デッドニングの工賃は？", "a": "フロントドア左右セットで29,000円（税込）から承っております。神戸市、姫路市、西宮市など県内全域、出張費込みの明朗会計です。" },
    { "q": "Amazonで買ったスピーカーを持ち込んでも大丈夫ですか？", "a": "はい、持ち込み料は完全無料です。ネットで購入された商品をそのままお渡しいただければ、プロの手で確実に取り付けいたします。" },
    { "q": "雨の日でも作業は可能ですか？", "a": "屋根のあるカーポート等があれば可能です。屋外の場合は、天候を見て日程調整をご相談させていただく場合がございます。" },
    { "q": "施工時間はどのくらいですか？", "a": "通常2〜3時間程度で完了します。車をお預かりすることなく、その場で作業が終わるため非常にスピーディーです。" },
    { "q": "デッドニングの効果はどのくらい持続しますか？", "a": "一度施工すれば、半永久的に効果が持続します。ドアの鉄板の振動を抑えることで、スピーカー本来の性能を長期にわたって引き出せます。" }
  ],
  "voiceItems": [
    {
      "stars": "★★★★★",
      "label": "神戸市 K.S様（30代）",
      "text": "「神戸市内で持ち込みスピーカーの取付を探していましたが、特急便さんは自宅の駐車場でやってくれるのが本当に助かりました。<strong>音の厚みが全然違います。</strong>」"
    },
    {
      "stars": "★★★★★",
      "label": "姫路市 M.A様（40代）",
      "text": "「姫路市まで出張してもらいました。<strong>見積もり通りの金額で安心。</strong>作業も手際よく、あっという間に完了しました。車内が静かになり大満足です！」"
    },
    {
      "stars": "★★★★★",
      "label": "西宮市 H.O様（50代）",
      "text": "「DIYは難しそうで断念していましたが、特急便さんに任せて正解。<strong>マンションの駐車場でも丁寧に作業してくれました。</strong>次はリアドアも依頼したいと思います！」"
    }
  ],
  "pricingNote": "✅ 材料持ち込み完全無料\n✅ 出張費込み（兵庫県全域）\n✅ 当日追加料金なし\n✅ 土日祝日対応OK",
  "relatedRegions": [
    { "name": "大阪府", "slug": "osaka" },
    { "name": "兵庫県", "slug": "hyogo", "active": true },
    { "name": "京都府", "slug": "kyoto" },
    { "name": "徳島県", "slug": "tokushima" }
  ]
}
