{
  "prefName": "三重県",
  "title": "三重のデッドニング＆スピーカー取付出張サービス【特急便】材料持込OK・29,000円〜",
  "description": "三重県でAmazon・楽天で買ったスピーカーの取付＋デッドニングを出張施工。材料持込大歓迎！フロントドア2枚セット工賃29,000円〜。ご自宅の駐車場で完結。専門店より圧倒的に安い！",
  "canonical": "https://abura.site/deadning/mie/",
  "aioDefinition": "三重県の出張デッドニングとは、自宅駐車場でプロがスピーカー交換と防音施工をセットで行うサービスです。津市や四日市市など三重全域に対応し、専門店の半額以下の適正価格で提供します。",
  "problemCity": "三重",
  "reasonsCity": "三重",
  "flowCity": "三重",
  "voiceCity": "三重",
  "areaBlocks": [
    {
      "title": "【北勢エリア】",
      "content": "四日市市・桑名市・いなべ市・鈴鹿市・亀山市・朝日町・川越町・菰野町・東員町"
    },
    {
      "title": "【中南勢エリア】",
      "content": "津市・松阪市・多気町・明和町・大台町"
    },
    {
      "title": "【伊勢志摩・伊賀エリア】",
      "content": "伊勢市・鳥羽市・志摩市・玉城町・度会町・南伊勢町・大紀町・伊賀市・名張市"
    },
    {
      "title": "【東紀州エリア】",
      "content": "尾鷲市・熊野市・紀北町・御浜町・紀宝町"
    }
  ],
  "faqItems": [
    { "q": "三重県での出張デッドニングの工賃はいくらですか？", "a": "フロントドア左右のセット施工で29,000円（税込）から承っております。三重県全域に出張費込みで対応いたします。店舗型の専門店相場と比較して大幅にコストを抑えられます。" },
    { "q": "四日市や津市以外の地域でも出張してもらえますか？", "a": "はい、伊勢市や伊賀市、尾鷲市などの東紀州エリアまで三重県全域に対応しております。遠方の方もお気軽にご相談ください。" },
    { "q": "材料は自分で用意したものを持ち込めますか？", "a": "はい、Amazonや楽天で購入された材料の持ち込みは大歓迎で、持ち込み料も一切かかりません。" },
    { "q": "雨天時の作業はどうなりますか？", "a": "屋根のあるスペースがあれば作業可能ですが、屋外の場合は日程を調整させていただく場合がございます。前日までにご相談させていただきます。" },
    { "q": "施工後の音の変化はどのくらいありますか？", "a": "ドアのビビリ音が消え、スピーカー本来のクリアな音が聞こえるようになります。またロードノイズの低減効果も実感いただけます。" }
  ],
  "voiceItems": [
    {
      "stars": "★★★★★",
      "label": "津市 K.S様（30代）",
      "text": "「津市内で持ち込みスピーカーの取付を探していましたが、特急便さんは自宅の駐車場でやってくれるのが決め手でした。<strong>音の厚みが全然違います。</strong>」"
    },
    {
      "stars": "★★★★★",
      "label": "四日市市 M.A様（40代）",
      "text": "「四日市市まで出張してもらいました。<strong>見積もり通りの金額で安心。</strong>作業も手際よく、あっという間に完了しました。車内が静かになり大満足です！」"
    },
    {
      "stars": "★★★★★",
      "label": "伊勢市 H.O様（50代）",
      "text": "「伊勢まで来てくれる業者がいなくて困っていましたが、快く引き受けてくれました。<strong>丁寧な作業で安心感がありました。</strong>次はリアもお願いします。」"
    }
  ],
  "pricingNote": "✅ 材料持ち込み完全無料\n✅ 出張費は見積もりに含まれます（三重県全域）\n✅ 当日追加料金なし\n✅ Amazon・楽天・ヤフオク品OK",
  "relatedRegions": [
    { "name": "三重県", "slug": "mie", "active": true },
    { "name": "大阪府", "slug": "osaka" },
    { "name": "愛知県", "slug": "aichi" }
  ]
}
