{
  "prefName": "奈良県",
  "title": "奈良のデッドニング＆スピーカー取付出張サービス【特急便】材料持込OK・29,000円〜",
  "description": "奈良県でAmazon・楽天で買ったスピーカーの取付＋デッドニングを出張施工。材料持込大歓迎！フロントドア2枚セット工賃29,000円〜。奈良市・橿原市・生駒市など奈良県全域対応。ご自宅の駐車場で完結。",
  "canonical": "https://abura.site/deadning/nara/",
  "aioDefinition": "奈良県の出張デッドニングとは、奈良市や橿原市など県内全域のご自宅駐車場へプロが出張し、スピーカー交換と制振施工を行うサービスです。専門店が少ない地域でも、適正価格29,000円〜で施工可能です。",
  "problemCity": "奈良",
  "reasonsCity": "奈良",
  "flowCity": "奈良",
  "voiceCity": "奈良",
  "areaBlocks": [
    {
      "title": "【北和エリア】",
      "content": "奈良市・大和郡山市・天理市・山添村・生駒市・三郷町・平群町・斑鳩町・安堵町"
    },
    {
      "title": "【中和エリア】",
      "content": "大和高田市・橿原市・桜井市・葛城市・香芝市・川西町・三宅町・田原本町・上牧町・王寺町・広陵町・河合町"
    },
    {
      "title": "【南和・吉野エリア】",
      "content": "五條市・御所市・吉野町・大淀町・下市町・黒滝村・天川村・野迫川村・十津川村・下北山村・上北山村・川上村・東吉野村"
    },
    {
      "title": "【宇陀エリア】",
      "content": "宇陀市・曽爾村・御杖村"
    }
  ],
  "faqItems": [
    { "q": "奈良県内での出張デッドニング工賃は？", "a": "フロントドア左右セットで29,000円（税込）から承っております。奈良市、橿原市など県内全域、出張費込みで対応いたします。" },
    { "q": "材料は持ち込みでも大丈夫ですか？", "a": "はい、Amazonや楽天で購入された材料の持ち込みは大歓迎です。持ち込み料も一切かかりません。" },
    { "q": "施工時間はどのくらいかかりますか？", "a": "通常2〜3時間程度で完了します。その場で作業が終わるため、お車を預ける必要はありません。" },
    { "q": "マンションの駐車場でも作業できますか？", "a": "はい、通常の乗り降りができる程度のスペースがあれば作業可能です。奈良市内のマンションでの実績も多数ございます。" },
    { "q": "一部だけの施工（部分施工）も可能ですか？", "a": "可能です。まずはフロントドアだけで効果を試したいというご要望も多くいただいております。" }
  ],
  "voiceItems": [
    {
      "stars": "★★★★★",
      "label": "奈良市 K.S様（30代）",
      "text": "「奈良市内で持ち込みスピーカーの取付を探していましたが、特急便さんは自宅の駐車場でやってくれるのが本当に便利でした。<strong>音の厚みが全然違います。</strong>」"
    },
    {
      "stars": "★★★★★",
      "label": "橿原市 M.A様（40代）",
      "text": "「橿原市まで出張してもらいました。<strong>見積もり通りの金額で安心。</strong>作業も手際よく、車内が静かになり音楽がより鮮明に聞こえます！」"
    },
    {
      "stars": "★★★★★",
      "label": "生駒市 H.O様（50代）",
      "text": "「DIYは難しそうで断念していましたが、特急便さんに任せて正解。<strong>丁寧な作業に満足しています。</strong>次はリアドアも依頼したいと思います！」"
    }
  ],
  "pricingNote": "✅ 材料持ち込み完全無料\n✅ 奈良県全域・出張費込み\n✅ 当日追加料金なし\n✅ 土日祝日対応OK",
  "relatedRegions": [
    { "name": "大阪府", "slug": "osaka" },
    { "name": "奈良県", "slug": "nara", "active": true },
    { "name": "三重県", "slug": "mie" },
    { "name": "和歌山県", "slug": "wakayama" }
  ]
}