{
  "prefName": "和歌山県",
  "title": "和歌山のデッドニング＆スピーカー取付出張サービス【特急便】材料持込OK・29,000円〜",
  "description": "和歌山県でAmazon・楽天で買ったスピーカーの取付＋デッドニングを出張施工。材料持込大歓迎！フロントドア2枚セット工賃29,000円〜。和歌山市・田辺市・橋本市など和歌山県全域対応。ご自宅の駐車場で完結。",
  "canonical": "https://abura.site/deadning/wakayama/",
  "aioDefinition": "和歌山県の出張デッドニングとは、和歌山市や田辺市など県内全域のご自宅駐車場へプロが出張し、スピーカー交換と制振施工を行うサービスです。専門店が少ない地域でも、適正価格29,000円〜で施工可能です。",
  "problemCity": "和歌山",
  "reasonsCity": "和歌山",
  "flowCity": "和歌山",
  "voiceCity": "和歌山",
  "areaBlocks": [
    {
      "title": "【海草・那賀エリア】",
      "content": "和歌山市・海南市・紀美野町・岩出市・紀の川市"
    },
    {
      "title": "【伊都エリア】",
      "content": "橋本市・かつらぎ町・九度山町・高野町"
    },
    {
      "title": "【有田・日高エリア】",
      "content": "有田市・湯浅町・広川町・有田川町・御坊市・美浜町・日高町・由良町・印南町・みなべ町・日高川町"
    },
    {
      "title": "【西牟婁・東牟婁エリア】",
      "content": "田辺市・白浜町・上富田町・すさみ町・新宮市・那智勝浦町・太地町・古座川町・串本町"
    }
  ],
  "faqItems": [
    { "q": "和歌山県内での出張デッドニング工賃は？", "a": "フロントドア左右セットで29,000円（税込）から承っております。和歌山市、田辺市、橋本市など県内全域、出張費込みで対応いたします。" },
    { "q": "材料は持ち込みでも大丈夫ですか？", "a": "はい、Amazonや楽天で購入された材料の持ち込みは大歓迎です。持ち込み料も一切かかりません。" },
    { "q": "施工時間はどのくらいかかりますか？", "a": "通常2〜3時間程度で完了します。その場で作業が終わるため、お車を預ける必要はありません。" },
    { "q": "雨の日でも作業可能ですか？", "a": "屋根のあるスペースがあれば可能です。屋外の場合は、天候を見て日程調整をご相談させていただきます。" },
    { "q": "一部だけの施工（部分施工）も可能ですか？", "a": "可能です。まずはフロントドアだけで効果を試したいというご要望も多くいただいております。" }
  ],
  "voiceItems": [
    {
      "stars": "★★★★★",
      "label": "和歌山市 K.S様（30代）",
      "text": "「和歌山市内で持ち込みスピーカーの取付を探していましたが、特急便さんは自宅の駐車場でやってくれるのが本当に便利でした。<strong>音の厚みが全然違います。</strong>」"
    },
    {
      "stars": "★★★★★",
      "label": "田辺市 M.A様（40代）",
      "text": "「田辺市まで出張してもらいました。<strong>見積もり通りの金額で安心。</strong>遠方でも快く引き受けてくれ、丁寧な作業で車内が静かになりました！」"
    },
    {
      "stars": "★★★★★",
      "label": "橋本市 H.O様（50代）",
      "text": "「DIYは難しそうで断念していましたが、特急便さんに任せて正解。<strong>丁寧な作業に満足しています。</strong>橋本まで来てくれてありがとうございました！」"
    }
  ],
  "pricingNote": "✅ 材料持ち込み完全無料\n✅ 和歌山県全域・出張費込み\n✅ 当日追加料金なし\n✅ 土日祝日対応OK",
  "relatedRegions": [
    { "name": "大阪府", "slug": "osaka" },
    { "name": "和歌山県", "slug": "wakayama", "active": true },
    { "name": "奈良県", "slug": "nara" },
    { "name": "徳島県", "slug": "tokushima" }
  ]
}